episode_no,episode_title,description,episode_runtime,released_on,lead_cast_matches,supporting_cast_matches,place_matches_cleaned,channel_title,publish_date,view_count,like_count,comment_count,runtime_minutes,is_successful,desc_length,desc_word_count,desc_sentence_count,avg_word_length,has_conflict,has_main_char,has_emotion,has_society,has_mystery,has_family,question_count,has_question,exclamation_count,total_cast,has_lead_cast,has_supporting_cast,cast_ratio,release_year,release_month,release_day,release_day_of_week,release_quarter,is_weekend,estimated_season,is_pilot,is_early_episode,is_milestone,cast_x_runtime,desc_length_x_questions,like_rate,comment_rate,engagement_rate
1924,Iyer Decides To Divorce Babita,All the men of Gokuldham society were discussing Iyer's problem at Gada Electronics. Iyer feels that Babita doesn't love him and decides that it's better to move out of the relationship and divorce her. Will his friends support his decision.,20 mins,2016-04-27,0.0,0.0,Gokuldham Society,Sony SAB,,5472266.0,56796.0,972.0,20.0,0,241,40,4,5.878048780487805,1,1,0,1,0,0,0,0,0,0.0,0,0,0.0,2016.0,4.0,27.0,2.0,2.0,0,8,0,0,0,0.0,0,0.010378879539320724,0.00017762291203992788,0.010556502451360653
1925,Iyer's New Girlfriend,"The secret meeting to discuss Iyer's problem is interrupted by Babita who drops in at Gada Electronics to buy a new phone for Iyer. However, Jethalal and Bagha have managed the situation and luckily she doesn't find out about her. Meanwhile, the men discuss how can Iyer bring back Babita's feelings for him.",21 mins,2016-04-28,0.0,0.0,,Sony SAB,,14097079.0,100142.0,2195.0,21.0,0,308,53,4,5.703703703703703,1,1,0,1,1,0,0,0,0,0.0,0,0,0.0,2016.0,4.0,28.0,3.0,2.0,0,8,0,0,0,0.0,0,0.007103740632811902,0.00015570600436402434,0.007259446637175926
1926,Mission Affair,"Jethalal and his friends are suggesting Iyer carry out with the plan to act as if he is having an affair, in front of Babita. He meets up with Sweety, in the same mall where all the women are going for shopping.",20 mins,2016-04-29,0.0,0.0,,Sony SAB,,26018901.0,165773.0,2520.0,20.0,1,211,42,3,4.906976744186046,0,1,0,0,0,0,0,0,0,0.0,0,0,0.0,2016.0,4.0,29.0,4.0,2.0,0,8,0,0,0,0.0,0,0.006371252714661057,9.685266503559605e-05,0.006468105379696653
1927,Iyer Flirts With Sweety,"Iyer is in the mall with sweety and they both are practising to be lovers. At that moment, Sweety's boyfriend walks in on them and decides to beat up Iyer. Jethalal comes in and clears up the confusion. Later, Iyer and Sweety get into character and start their mission in front of all the women of Gokuldham.",19 mins,2016-05-02,0.0,0.0,Gokuldham Society,Sony SAB,,11368133.0,107189.0,2931.0,19.0,0,308,57,5,5.310344827586207,0,1,0,1,0,0,0,0,0,0.0,0,0,0.0,2016.0,5.0,2.0,0.0,2.0,0,8,0,0,0,0.0,0,0.009428900116764985,0.00025782595454979684,0.009686726071314782
1928,Iyer's Affair Exposed,Iyer's plan to act in front of Babita has been successful. Now Babita knows that he is cheating on her and is having an affair with another woman. All the women return to the society and an atmosphere of tension is created where everyone wants to hear the truth from Iyer's mouth.,19 mins,2016-05-03,0.0,0.0,Gokuldham Society,Sony SAB,,35262708.0,263714.0,6771.0,19.0,1,280,52,4,5.283018867924528,0,1,0,1,0,0,0,0,0,0.0,0,0,0.0,2016.0,5.0,3.0,1.0,2.0,0,8,0,0,0,0.0,0,0.007478551917267615,0.00019201587716927818,0.0076705677944368935
1929,Confronting Iyer,"All the adult members of Gokuldham Societey have assembled in the compound. All of them seem furious and want answers from Iyer. Iyer walks in but doesn't seem to be worried at all. However, he reveals something which will shake Babita to her core.",19 mins,2016-05-04,0.0,0.0,Gokuldham Society,Sony SAB,,15080806.0,138006.0,3411.0,19.0,0,248,44,5,5.511111111111111,0,1,0,1,0,0,0,0,0,0.0,0,0,0.0,2016.0,5.0,4.0,2.0,2.0,0,8,0,0,0,0.0,0,0.009151101794486197,0.00022618152994067229,0.00937728332442687
1930,Babita Calls A Divorce Lawyer,"Babita has been shattered upon hearing that Iyer doesn't love her and wants to divorce her. She leaves her house and is gonna stay at Jethalal's for a while. However, Iyer has been forbidden from staying in the society by Champaklal. At Jethalal's house, Babita has made up her mind to divorce Iyer and calls a lawyer for counsel. Stay tuned to find out what will happen next.",19 mins,2016-05-05,0.0,0.0,Gokuldham Society,Sony SAB,,9600438.0,93309.0,2535.0,19.0,0,376,68,6,5.449275362318841,0,1,0,1,1,0,0,0,0,0.0,0,0,0.0,2016.0,5.0,5.0,3.0,2.0,0,8,0,0,0,0.0,0,0.009719243047114825,0.0002640504251940979,0.009983293472308922
1931,Bechara Iyer,"Iyer is at the house of God, crying over his cruel fate. Meanwhile, everyone in Gokuldham has come to know about Babita's decision to call a lawyer tomorrow. Bhide, Sodhi and Popatlal feel bad for their friend and bring him food and other stuff, in the middle of the night.",19 mins,2016-05-06,0.0,0.0,Gokuldham Society,Sony SAB,,16608898.0,151027.0,3727.0,19.0,1,273,50,4,5.352941176470588,0,1,0,1,0,0,0,0,0,0.0,0,0,0.0,2016.0,5.0,6.0,4.0,2.0,0,8,0,0,0,0.0,0,0.009093137359676881,0.00022439777615602334,0.009317535135832906
1932,C Wing Ka Vastu,"Bhide, Sodhi, and Popatlal are thinking about the outcome of Iyer's decision to divorce Babita. Bhide thinks that something is wrong with the whole C Wing of Gokuldham society, where everyone is unmarried, including Popatlal. Meanwhile, Babita is extremely sad and unable to sleep.",19 mins,2016-05-09,0.0,0.0,Gokuldham Society,Sony SAB,,22903324.0,192517.0,4574.0,19.0,1,281,44,4,6.2444444444444445,0,1,1,1,0,0,0,0,0,0.0,0,0,0.0,2016.0,5.0,9.0,0.0,2.0,0,8,0,0,0,0.0,0,0.008405635426297273,0.0001997089942180884,0.008605344420515361
1933,Last Cab Ride Togethere,"Iyer and Babita's divorce procedure is going on. Meanwhile, both Iyer and Babita both, decide to leave Gokuldham. Everyone decides to convince them of the fault in their decision. But they don't listen and are set on their path. Both of them decide to share one last cab ride together before separating.",20 mins,2016-05-10,0.0,0.0,Gokuldham Society,Sony SAB,,26832744.0,235287.0,5120.0,20.0,1,303,52,6,5.716981132075472,0,1,0,1,0,0,0,0,0,0.0,0,0,0.0,2016.0,5.0,10.0,1.0,2.0,0,8,0,0,0,0.0,0,0.008768651884106528,0.0001908116370501788,0.008959463521156705
1934,Iyer And Babita Togethere Again,"Gokuldham Society members have found out the truth and the fact that Iyer misunderstood Babita. They are trying their phones but neither of them is picking up. However, Iyer and Babita suddenly appear before all of them.",19 mins,2016-05-11,0.0,0.0,Gokuldham Society,Sony SAB,,5828872.0,54463.0,1210.0,19.0,0,220,37,4,5.7894736842105265,0,1,0,1,0,0,0,0,0,0.0,0,0,0.0,2016.0,5.0,11.0,2.0,2.0,0,8,0,0,0,0.0,0,0.009343658714128787,0.0002075872986081529,0.00955124601273694
1935,Misunderstanding Over,"The misunderstanding between Iyer and Babita is now over and everyone in Gokuldham Society is very happy for them. Meanwhile, Babita's friend, Maushami, has come to thank her. What does she want to thank Babita for?",18 mins,2016-05-12,0.0,0.0,Gokuldham Society,Sony SAB,,3354917.0,32624.0,715.0,18.0,0,215,36,4,5.8108108108108105,0,1,1,1,0,0,1,1,0,0.0,0,0,0.0,2016.0,5.0,12.0,3.0,2.0,0,8,0,0,0,0.0,215,0.009724231709985163,0.0002131199629916439,0.009937351672976807
1936,Mohammad Azharuddin Calls Popatlal,"Former Indian Cricket Team captain, Mohammad Azharuddin, calls Popatlal to know about the Gokuldham Premier League (GPL). He surprises Popatlal and his friends by calling them suddenly and he appreciates everyone. Meanwhile, Champaklal talks to Daya and Jetha about today's fragile marriages.",20 mins,2016-05-13,0.0,0.0,Gokuldham Society,Sony SAB,,6940938.0,55447.0,1148.0,20.0,0,292,42,4,6.790697674418604,0,1,0,1,0,0,0,0,0,0.0,0,0,0.0,2016.0,5.0,13.0,4.0,2.0,0,8,0,0,0,0.0,0,0.007988400416715951,0.0001653954889965176,0.008153795905712469
1937,Babita's Gift For Iyer,"Jethalal receives a call from Babita, who informs him about her plans to go on an African Safari during this Diwali vacation. Moreover, she informs Jethalal that she wants to give a surprise to Iyer by gifting him the latest smartphone.",19 mins,2016-05-16,0.0,0.0,,Sony SAB,,14003931.0,95736.0,1570.0,19.0,0,236,41,3,5.619047619047619,0,1,0,0,0,0,0,0,0,0.0,0,0,0.0,2016.0,5.0,16.0,0.0,2.0,0,8,0,0,0,0.0,0,0.006836365672155506,0.00011211136986383538,0.006948477042019342
1938,Sonu's Vacation Camp,"Bhide is secretly taking out Sonu's summer vacation camp luggage from his flat. Bhide is seen rushing on his Shakharam to give the luggage bag to Sonu, but he is interrupted by Popatlal. Will Bhide be able to reach Sonu in time.",19 mins,2016-05-17,0.0,0.0,,Sony PAL,,5404557.0,57958.0,873.0,19.0,0,228,42,4,5.3023255813953485,0,1,0,0,0,1,0,0,0,0.0,0,0,0.0,2016.0,5.0,17.0,1.0,2.0,0,8,0,0,0,0.0,0,0.010723911187556874,0.00016153032310875376,0.010885441510665627
1939,Popatlal's Ujjain Trip,"Jethalal and his friends are waiting for Popatlal at the soda shop. They are seen gossiping and enjoying their time with each other. However, It's getting late and still, Popatlal has not joined them at the soda shop. Sodhi calls Popatlal and finds out that he is going to Ujjain.",19 mins,2016-05-18,0.0,0.0,,Sony SAB,,5442702.0,48452.0,504.0,19.0,0,280,50,5,5.490196078431373,0,1,0,0,0,0,0,0,0,0.0,0,0,0.0,2016.0,5.0,18.0,2.0,2.0,0,8,0,0,0,0.0,0,0.008902194369231611,9.260104767796442e-05,0.008994795416909576
1940,Madhavi's Mango Business,"Daya is convincing Madhvi to start a new business this summer season. She advises her to start selling mangoes in the market. And interestingly, Anjali too suggests her to start the mango selling business. Will Madhavi take their advice? Watch the episode to find out.",19 mins,2016-05-19,0.0,0.0,,Sony SAB,,3725115.0,30334.0,553.0,19.0,0,268,45,6,5.826086956521739,0,1,0,0,1,1,1,1,0,0.0,0,0,0.0,2016.0,5.0,19.0,3.0,2.0,0,8,0,0,0,0.0,268,0.008143102120846707,0.00014845175291185563,0.008291553873758562
1941,Confusion In Madhavi's New Business,"Madhavi is taking orders for supplying mangoes to her customers. She is very excited by the overwhelming response of the pre-booking of the orders, and she starts thinking about a huge profit which she will make by working from home. However, there is confusion between the cost price and the selling price of mangoes. Will Madhavi come to know about it?",20 mins,2016-05-20,0.0,0.0,,Sony SAB,,5490719.0,40132.0,728.0,20.0,0,354,61,5,5.709677419354839,0,0,1,0,0,0,1,1,0,0.0,0,0,0.0,2016.0,5.0,20.0,4.0,2.0,0,8,0,0,0,0.0,354,0.007309059649736283,0.00013258734737885014,0.007441646997115132
1942,Aam Ka Jaadu,"The mango seller, Ganpat Rao has come to the Gokuldham Society with a mini truck full of mangoes. He has arrived a little late and all the impatient customers are waiting to have the best quality of mangoes this season. Stay tuned to find out more.",19 mins,2016-05-23,0.0,0.0,Gokuldham Society,Sony SAB,,5979899.0,47207.0,801.0,19.0,0,248,46,4,5.276595744680851,0,0,0,1,1,1,0,0,0,0.0,0,0,0.0,2016.0,5.0,23.0,0.0,2.0,0,8,0,0,0,0.0,0,0.00789427916854797,0.00013394872823960268,0.008028227896787572
1943,Loss In New Business,"Everyone in Gokuldham society is enjoying the taste of the famous Ratnagiri Mangoes. Madhavi too is very happy thinking that she has sold the mangoes to her customers at a cheaper rate. However, her happiness is about to be crushed when the wholesaler comes to collect the payment.",20 mins,2016-05-24,0.0,0.0,Gokuldham Society,Sony SAB,,13003838.0,108086.0,1705.0,20.0,0,281,48,4,5.73469387755102,0,0,1,1,0,0,0,0,0,0.0,0,0,0.0,2016.0,5.0,24.0,1.0,2.0,0,8,0,0,0,0.0,0,0.008311853138138668,0.00013111512684830994,0.008442968264986979
1944,Sundar Helps Madhavi,"Madhavi's has just incurred a loss in her new business. She is feeling very disheartened and in order to repay the excess amount to the mango wholesaler, she meets Jethalal to seek some financial help from him.  However, on reaching there, she meets Jethalal’s brother-in-law Sundar. He gives her a bulk order of 50 boxes of Ratnagiri mangoes and pays an advance amount.",20 mins,2016-05-25,0.0,0.0,,Sony SAB,,4352058.0,35934.0,618.0,20.0,0,370,63,5,5.78125,0,1,0,0,0,0,0,0,0,0.0,0,0,0.0,2016.0,5.0,25.0,2.0,2.0,0,8,0,0,0,0.0,0,0.008256781445288311,0.00014200175135493337,0.008398783196643243
1945,Awaiting Gogi's Result,"Bhide informs Sodhi about Gogi's results, which is expected to come by the next day. Gogi is tensed about his result. However, Sodhi is full of confidence that his son will do well in his exam and will get admission to MK Gandhi College. Keep watching the episode to find out more.",20 mins,2015-05-26,0.0,0.0,,Sony SAB,,3823151.0,32629.0,801.0,20.0,0,281,52,5,5.30188679245283,0,0,0,0,1,1,0,0,0,0.0,0,0,0.0,2015.0,5.0,26.0,1.0,2.0,0,8,0,0,0,0.0,0,0.00853458089032296,0.00020951298823588494,0.008744093878558843
1946,Sodhi's Excitement,"Bhide is very tensed for Gogi's SSC results. He is getting a little scared thinking about Sodhi's excitement and preparation which he is doing for his son's result. Sodhi has completed all the preparations for Gogo's result, even before it is announced.",20 mins,2016-05-27,0.0,0.0,,Sony SAB,,7571446.0,60475.0,1132.0,20.0,0,253,42,4,5.883720930232558,0,0,1,0,0,1,0,0,0,0.0,0,0,0.0,2016.0,5.0,27.0,4.0,2.0,0,8,0,0,0,0.0,0,0.007987244710291178,0.00014950907006282946,0.008136753780354007
1947,Gogi Ka SSC Result,"Residents of Gokuldham Society have gathered in the clubhouse to check Gogi's SSC result. Even before the formal announcement of SSC result, everyone has started celebrating and congratulating Gogi. However, Bhide seems a little worried.",20 mins,2016-05-30,0.0,0.0,Gokuldham Society,Sony SAB,,11196792.0,106695.0,2870.0,20.0,0,237,35,4,6.583333333333333,0,0,0,1,0,0,0,0,0,0.0,0,0,0.0,2016.0,5.0,30.0,0.0,2.0,0,8,0,0,0,0.0,0,0.009529067832190877,0.0002563233954579673,0.009785391227648845
1948,Celebrations For Gogi's Result,Gogi's school teacher inform Sodhi about his SSC result. The school teacher informs that Gogi has become a school topper with his marvellous performance in the SSC exams. On hearing this awesome news the whole Gokuldham society starts celebrating.,17 mins,2016-05-31,0.0,0.0,Gokuldham Society,Sony SAB,,6522919.0,52013.0,1048.0,17.0,0,247,39,4,6.175,0,0,0,1,0,0,0,0,0,0.0,0,0,0.0,2016.0,5.0,31.0,1.0,2.0,0,8,0,0,0,0.0,0,0.007973882862276405,0.00016066424239451042,0.008134547104670915
1949,Phone Banned In Gada Electronics,"Bagha recalls the decision of Jethalal on banning mobile phones inside his shop. He is in tension thinking that from now onwards, he will be unable to talk with Bawari during his working hours. Keep watching to find out more.",19 mins,2016-06-01,0.0,0.0,,Sony PAL,,4028892.0,41675.0,648.0,19.0,0,225,40,4,5.487804878048781,0,1,0,0,1,0,0,0,0,0.0,0,0,0.0,2016.0,6.0,1.0,2.0,2.0,0,8,0,0,0,0.0,0,0.01034403246747928,0.00016083822528917992,0.01050487069276846
1950,Bawri Aur Bagha Ka Chakravyuh,"Jethalal is in tension thinking about Bawris habit of coming to Gada Electronics. He feels that it is because of her, Bagha is unable to concentrate on his work. However, Daya suggests Jethalal to help tie the knots between Bawri and Bagha.",20 mins,2016-06-02,0.0,0.0,,Sony PAL,,3546995.0,41333.0,503.0,20.0,0,240,42,4,5.5813953488372094,0,1,0,0,0,0,0,0,0,0.0,0,0,0.0,2016.0,6.0,2.0,3.0,2.0,0,8,0,0,0,0.0,0,0.011652959292877692,0.00014181014018623081,0.011794769433063922
1951,Bawri Aur Bagha Wali Samasya,"Taarak suggests Jethalal to send Bagha, Bawri, Champaklal and Daya to Kanpur for Bagha and Bawri's engagement to avoid Bawri's parents coming to Mumbai. But her parents arrive in Mumbai to surprise Bawri. What will Jethalal do now?",18 mins,2016-06-03,0.0,0.0,,Sony PAL,,4697342.0,50068.0,711.0,18.0,0,231,38,4,5.923076923076923,0,1,0,0,1,0,1,1,0,0.0,0,0,0.0,2016.0,6.0,3.0,4.0,2.0,0,8,0,0,0,0.0,231,0.010658791576429483,0.0001513621636742303,0.010810153740103714
1952,Bawri's Parents In Gokuldham Society,Jethalal informs Daya and Champaklal that Bawri's parents have arrived in Mumbai. Jethalal does everything he can to avoid them but Bawri's parents rent a house in Gokuldham society for a month. How will Jethalal and his family avoid them?,20 mins,2016-06-06,0.0,0.0,Gokuldham Society,Sony SAB,,4881466.0,38556.0,725.0,20.0,0,239,40,4,5.829268292682927,0,1,0,1,0,1,1,1,0,0.0,0,0,0.0,2016.0,6.0,6.0,0.0,2.0,0,8,0,0,0,0.0,239,0.007898445282944656,0.0001485209261887871,0.008046966209133442
1953,Bawri's Parents at Jethalal's House,Taarak suggests Jethalal to move out of Mumbai until Bagha's engagement. Bawri is shocked to know that her parents have rented a house in Mumbai. Bawri's parents arrive at Gada house while Jethalal is leaving for Bhachau. How will he escape this situation?,19 mins,2016-06-07,0.0,0.0,,Sony SAB,,5858752.0,50836.0,1197.0,19.0,0,256,43,5,5.818181818181818,0,1,0,0,1,0,1,1,0,0.0,0,0,0.0,2016.0,6.0,7.0,1.0,2.0,0,8,0,0,0,0.0,256,0.008676931763465706,0.00020430968842687173,0.008881241451892579
1954,Jethalal Ka Balidaan,"Jethalal, Champaklal and Daya decide that Jethalal will act as the servant for time being. Jethalal calls Bagha and Natu Kaka and tells them to reach Gada house quickly. Tapu comes home and addresses Daya as his mother. Bawri's parents are baffled to hear this. Will all their lies come to an end? Tune in to find out.",19 mins,2016-06-08,0.0,0.0,,Sony SAB,,17160454.0,115765.0,2237.0,19.0,1,318,58,7,5.389830508474576,0,1,0,0,1,1,1,1,0,0.0,0,0,0.0,2016.0,6.0,8.0,2.0,2.0,0,8,0,0,0,0.0,318,0.0067460332491183946,0.0001303578489031905,0.006876391098021585
1955,Bagha's Servant Jethalal,Everyone is shocked to know that Bawri's parents have rented a house in Gokuldham society for a month. Bawri's mother orders Jethalal to clean their rented house. Bhide arrives at Gada house and asks for the maintenance cheque from Jethalal. Is this the end of Bagha-Bawri love story?,21 mins,2016-06-09,0.0,0.0,Gokuldham Society,Sony SAB,,10062999.0,86559.0,1421.0,21.0,0,284,48,5,5.795918367346939,0,1,0,1,0,1,1,1,0,0.0,0,0,0.0,2016.0,6.0,9.0,3.0,2.0,0,8,0,0,0,0.0,284,0.008601709231839411,0.00014121037463976944,0.008742919606479181
1956,Baagha's Secret Is Revealed To The Society,"Natu Kaka informs Bhide about the whole situation, Bhide calls a meeting and informs all the members of the Gokuldham society about Jethalal's role play. Will the entire society be able to keep this secret?",19 mins,2016-06-10,0.0,0.0,Gokuldham Society,Sony SAB,,13272519.0,119712.0,2291.0,19.0,0,206,35,3,5.722222222222222,0,1,0,1,0,0,1,1,0,0.0,0,0,0.0,2016.0,6.0,10.0,4.0,2.0,0,8,0,0,0,0.0,206,0.00901953811333492,0.00017261228463019834,0.009192150397965119
1957,Preparations For Bagha's Engagement,"Sodhi lifts Jethalal in excitement, just then Bawri's parents walk in. Bawri's parents inform Bagha that the expenses for the engagement will be taken care off by the groom. Natu Kaka and Bagha are tensed about how will they arrange the money?",20 mins,2016-06-13,0.0,0.0,,Sony SAB,,10159786.0,87396.0,1466.0,20.0,0,243,42,4,5.651162790697675,0,1,0,0,0,0,1,1,0,0.0,0,0,0.0,2016.0,6.0,13.0,0.0,2.0,0,8,0,0,0,0.0,243,0.008602148844262188,0.00014429436365152144,0.008746443207913708
1958,Bagha's Truth,Jethalal and family assure Bagha and Natu Kaka that they will help them with the expenses for the engagement. All the members of the Gokuldham society are busy with the preparations of the engagement. Will everything go according to the plan?,18 mins,2016-06-14,0.0,0.0,Gokuldham Society,Sony SAB,,23253490.0,165093.0,3496.0,18.0,1,242,41,4,5.761904761904762,0,1,0,1,1,1,1,1,0,0.0,0,0,0.0,2016.0,6.0,14.0,1.0,2.0,0,8,0,0,0,0.0,242,0.007099708168549832,0.00015034301731297033,0.007250051185862802
1959,Bijli Devi's Adds To Jethalal's Misery,"All the members of the Gokuldham society welcome all the guests and hope that everything goes as planned. Bawri's parents inform everyone that the engagemnet can't take place without the presence of the head of their community ""Bijli Devi"". Bijli Devi arrives at the engagement. Will she add to Jethalal's misery?",21 mins,2016-06-15,0.0,0.0,Gokuldham Society,Sony SAB,,28081168.0,249368.0,6571.0,21.0,1,313,51,5,6.019230769230769,0,1,0,1,1,0,1,1,0,0.0,0,0,0.0,2016.0,6.0,15.0,2.0,2.0,0,8,0,0,0,0.0,313,0.008880257086163329,0.00023400022983373662,0.009114257315997066
1960,Bijli Devi Wants Daya To Get Married,Bijli Devi tells Daya that she should get married first because she is Bagha's sister. She asks Daya that she should choose a groom amongst the men present at the engagement and get married here and now since according to the rituals if Bagha and Bawri's engagement doesn't happen today then they will never be able to get married.,20 mins,2016-06-16,0.0,0.0,,Sony SAB,,23324262.0,216950.0,5476.0,20.0,1,331,59,3,5.516666666666667,0,1,0,0,0,0,0,0,0,0.0,0,0,0.0,2016.0,6.0,16.0,3.0,2.0,0,8,0,0,0,0.0,0,0.009301472891126292,0.00023477697880528958,0.009536249869931582
1961,Bagha And Bawri's Engagement,"Bawri's parents want Jethalal to be thrown out of the wedding, Bagha takes a stand and tells them the truth. Bawri's parents feel that they have been fooled and want to break the engagement. Members of the Gokuldham society try to convince them but they are firm on their decision.",19 mins,2016-06-17,0.0,0.0,Gokuldham Society,Sony SAB,,12677512.0,110731.0,1900.0,19.0,0,281,50,4,5.509803921568627,0,1,0,1,0,0,0,0,0,0.0,0,0,0.0,2016.0,6.0,17.0,4.0,2.0,0,8,0,0,0,0.0,0,0.008734441842023747,0.00014987166646959857,0.008884313508493346
1962,Happily Engaged,"Bawri's parents finally agree, Bagha and Bagha are happily engaged. Jethalal breathes a sigh of relief that he doesn't have to be a servant anymore. Taarak takes inspiration from the entire incident and writes an article.",20 mins,2016-06-20,0.0,0.0,,Sony SAB,,11337144.0,93897.0,1070.0,20.0,0,221,36,4,5.972972972972973,0,1,0,0,0,0,0,0,0,0.0,0,0,0.0,2016.0,6.0,20.0,0.0,2.0,0,8,0,0,0,0.0,0,0.008282243898265393,9.43800224836147e-05,0.008376623920749006
1963,Bhide Calls An Urgent Meeting,Bhide returns to Gokuldham society and notices leakage and cracks in the society. He decides to urgently call a meeting. Popatlal informs that his friend is a contractor and they can hire him for this task and everyone agrees.,20 mins,2016-06-21,0.0,0.0,Gokuldham Society,Sony PAL,,10588004.0,97321.0,1239.0,20.0,0,226,39,4,5.65,0,1,0,1,0,0,0,0,0,0.0,0,0,0.0,2016.0,6.0,21.0,1.0,2.0,0,8,0,0,0,0.0,0,0.009191627695680158,0.00011701921183452407,0.009308646907514683
1964,Bhide Scolds Madhavi,"Popatlal assures everyone that his friend will start the repairing on time. Bhide informs Tapu Sena that he has a surprise for them. What is the surprise? Will the repairing work at Gokuldham conclude without any obstacle? Only one way to find out, keep watching.",20 mins,2016-06-22,0.0,0.0,Gokuldham Society,Sony SAB,,13573224.0,87209.0,1556.0,20.0,0,263,45,6,5.717391304347826,0,1,0,1,1,0,2,1,0,0.0,0,0,0.0,2016.0,6.0,22.0,2.0,2.0,0,8,0,0,0,0.0,526,0.0064250758386455685,0.00011463745719974435,0.0065397132958453135
1965,Sonu's Surprise For Her Friends,Tapu Sena comes to Bhide's house and are happily surprised to know that Sonu has returned from her summer camp. Anjali complains Taarak that he doeasn't pay any attention to her. Bhide is inspecting the repairing work in the society.,19 mins,2016-06-23,0.0,0.0,Gokuldham Society,Sony SAB,,7168927.0,49832.0,893.0,19.0,0,233,40,4,5.682926829268292,0,1,0,1,0,1,0,0,0,0.0,0,0,0.0,2016.0,6.0,23.0,3.0,2.0,0,8,0,0,0,0.0,0,0.006951109008208759,0.00012456534645068271,0.007075674354659441
1966,Bhide Questions Jethalal,A woman calls Bhide and enquires about his tuition classes. Bhide calls up Jethalal and asks for his maintenance cheque which turns into an argument. Tune in to witness the hilarious argument between Bhide and Jethalal.,20 mins,2016-06-24,0.0,0.0,,Sony SAB,,6841876.0,49456.0,837.0,20.0,0,219,36,4,5.918918918918919,1,1,0,0,0,0,0,0,0,0.0,0,0,0.0,2016.0,6.0,24.0,4.0,2.0,0,8,0,0,0,0.0,0,0.00722842576678885,0.0001223348505095897,0.00735076061729844
1967,Popatlal Ka Rashi Bhavishya,Bhide notices that Popatlal has given the maintenance cheque without signing it. Bhide calls Popatlal for the same but he ignores him. Bhide tricks Popatlal by telling him that he knows of a bachelorette girl that might be interested in marrying him. How will Popatlal react when he finds out that he has been fooled?,18 mins,2016-06-27,0.0,0.0,,Sony SAB,,11563534.0,73368.0,1767.0,18.0,0,317,55,5,5.660714285714286,0,1,0,0,0,0,1,1,0,0.0,0,0,0.0,2016.0,6.0,27.0,0.0,2.0,0,8,0,0,0,0.0,317,0.006344772597652881,0.00015280794324572892,0.006497580540898609
1968,Popatlal's New Love Story,Popatlal bumps into a girl who's riding a bicycle. She offers to drop him to his office since he is getting late. Popatlal meets Inspector Chalu Pandey to discuss with him about an article. Popatlal informs all the men of the Gokuldham society about the mysterious girl and hopes that he bumps into her again.,40 mins,2016-06-28,0.0,0.0,Gokuldham Society,Sony SAB,,2868997.0,26574.0,684.0,40.0,0,309,55,5,5.517857142857143,0,1,0,1,0,0,0,0,0,0.0,0,0,0.0,2016.0,6.0,28.0,1.0,2.0,0,8,0,0,0,0.0,0,0.009262467244661725,0.0002384107622243027,0.009500878006886027
1969,That Girl On A Bicycle,At the soda shop Bhide reminds Popatlal about the maintenance cheque which turns into an argument. Bhide informs Madhavi and Jethalal informs Daya about Popatlal's mysterious girl. Popatlal day dreams about meeting that girl again. Will his dream come true?,18 mins,2016-06-29,0.0,0.0,,Sony SAB,,5436642.0,33654.0,845.0,18.0,0,257,40,5,6.2682926829268295,1,1,1,1,0,0,1,1,0,0.0,0,0,0.0,2016.0,6.0,29.0,2.0,2.0,0,8,0,0,0,0.0,257,0.006190217014433355,0.00015542679554276416,0.00634564380997612
