episode_no,episode_title,description,episode_runtime,released_on,lead_cast_matches,supporting_cast_matches,place_matches_cleaned,channel_title,publish_date,view_count,like_count,comment_count,runtime_minutes,is_successful,desc_length,desc_word_count,desc_sentence_count,avg_word_length,has_conflict,has_main_char,has_emotion,has_society,has_mystery,has_family,question_count,has_question,exclamation_count,total_cast,has_lead_cast,has_supporting_cast,cast_ratio,release_year,release_month,release_day,release_day_of_week,release_quarter,is_weekend,estimated_season,is_pilot,is_early_episode,is_milestone,cast_x_runtime,desc_length_x_questions,like_rate,comment_rate,engagement_rate
1474,Bhide Is Lost,Gokuldham members are searching for their Group Leader Bhide in Disneyland. Producer Asit tells them not to miss Disneylands parade. Why is Asit worried?,20 mins,2020-05-31,0.0,0.0,Gokuldham Society,Sony SAB,,8224845.0,52535.0,1155.0,20.0,0,153,24,4,6.12,0,0,0,1,0,0,1,1,0,0.0,0,0,0.0,2020.0,5.0,31.0,6.0,2.0,1,6,0,0,0,0.0,153,0.0063873536355574315,0.00014042816120812473,0.006527781796765556
1475,Bhide Is Nowhere To Be Found,Members of Gokuldham Society who are in Disneyland are mesmerized to see the wonderful world. Tapu Sena reveals their wish to Popatlal. Where is the Captain of the group? Where is Bhide?,20 mins,2020-05-31,0.0,0.0,Gokuldham Society,Sony SAB,,20862356.0,115173.0,2537.0,20.0,1,186,32,5,5.636363636363637,0,1,0,1,0,0,2,1,0,0.0,0,0,0.0,2020.0,5.0,31.0,6.0,2.0,1,6,0,0,0,0.0,372,0.00552061303523854,0.0001216065854879197,0.005642219620726459
1476,The Passport,Bhide and Madhvi have planned a special surprise for Sonu. Asit informs Jethalal about the passport issue and also rushes for Hong Kong immediately. All the members are having fun in the amazing city of Hong Kong.,18 mins,2020-05-31,0.0,0.0,,Sony SAB,,19535254.0,96196.0,2084.0,18.0,1,213,37,4,5.605263157894737,0,1,0,1,0,1,0,0,0,0.0,0,0,0.0,2020.0,5.0,31.0,6.0,2.0,1,6,0,0,0,0.0,0,0.004924225458024479,0.0001066789248463867,0.005030904382870866
1477,The Wrath Of Iyer,Iyer fumes in anger as he gets to know that all the passports of Gokuldham members have got misplaced who are enjoying in Hong Kong. Asit Bhai is searching for Gokuldham members. Will they be able to return to India?,18 mins,2020-05-31,0.0,0.0,Gokuldham Society,Sony SAB,,13966700.0,82810.0,1570.0,18.0,0,216,40,4,5.2682926829268295,0,1,0,1,0,0,1,1,0,0.0,0,0,0.0,2020.0,5.0,31.0,6.0,2.0,1,6,0,0,0,0.0,216,0.0059291023699870144,0.00011241022486269306,0.0060415125948497074
1478,A Safe Return?,Gokuldham members have safely returned to India from Hong Kong. Gada Family is shocked to see that the lock of their house is missing. Tapu finds another way to get in the House. Who is there in the Gada House?,19 mins,2020-05-31,0.0,0.0,Gokuldham Society,Sony SAB,,10984886.0,66765.0,1074.0,19.0,0,210,40,5,5.121951219512195,0,1,0,1,0,1,1,1,0,0.0,0,0,0.0,2020.0,5.0,31.0,6.0,2.0,1,6,0,0,0,0.0,210,0.00607789593101868,9.777069167848518e-05,0.006175666622697165
1479,The Intruder,Inspector Chalu Pandey and his team arrive in Gada House to search the stalker who has secretly entered in Jethalal's House. Stalker finally gets arrested and all the members of Gokuldham Society are shocked to see him. Who is he? How did he enter?,20 mins,2020-05-31,0.0,0.0,Gokuldham Society,Sony SAB,,8544791.0,73834.0,1918.0,20.0,0,248,44,5,5.511111111111111,0,1,0,1,0,0,2,1,0,0.0,0,0,0.0,2020.0,5.0,31.0,6.0,2.0,1,6,0,0,0,0.0,496,0.008640818875403872,0.00022446421165079266,0.008865283087054664
1480,The Journey Video,Those who could not make it to Hong Kong are eagerly waiting to see the journey. There is a surprise for the members who could not make it to Disneyland Hong Kong. What is the surprise?,19 mins,2020-05-31,0.0,0.0,,Sony SAB,,13757061.0,75733.0,1589.0,19.0,0,185,36,4,5.0,0,0,0,1,0,0,1,1,0,0.0,0,0,0.0,2020.0,5.0,31.0,6.0,2.0,1,6,0,0,0,0.0,185,0.00550502716350337,0.00011550431334830067,0.005620531476851671
1481,Anjali Breakdowns In Tears,Peon Dattu who was an X employee in Taarak Mehta's office reveals a shocking truth to Anjali about Taaraks special activity. Anjali breaks down into tears and urgently calls Jethalal in Mehta House. Will Taarak and Jethalal land in deep trouble?,20 mins,2020-05-31,0.0,0.0,,Sony SAB,,11949136.0,93835.0,1904.0,20.0,0,245,41,4,5.833333333333333,1,1,0,0,0,0,1,1,0,0.0,0,0,0.0,2020.0,5.0,31.0,6.0,2.0,1,6,0,0,0,0.0,245,0.00785286837032666,0.00015934205122930634,0.008012210421555966
1482,The Promise,"Anjali urgently calls Jethalal, Popatlal, Dr. Hatthi, Sodhi and Iyer in Mehta House and also reveals the truth about his diet food. Anjali leaves the Mehta House. How will Gokuldham members solve Taarak's problem?",19 mins,2020-05-31,0.0,0.0,Gokuldham Society,Sony SAB,,8510943.0,96888.0,1559.0,19.0,0,213,34,5,6.085714285714285,1,1,0,1,0,0,1,1,0,0.0,0,0,0.0,2020.0,5.0,31.0,6.0,2.0,1,6,0,0,0,0.0,213,0.011383931089195276,0.00018317592032094206,0.011567107009516218
1483,The Promise Is Kept,Anjali leaves in an emergency but her being concerned about Taarak's diet drives everyone crazy. She decides to take an ultimatum and asks Taarak to swear on his love and forbids him to eat unhealthy items. Taarak being an honest husband denies all the temptations and keeps his promise.,20 mins,2020-05-31,0.0,0.0,,Sony SAB,,8711792.0,67678.0,1446.0,20.0,0,287,49,4,5.74,0,0,0,0,0,1,0,0,0,0.0,0,0,0.0,2020.0,5.0,31.0,6.0,2.0,1,6,0,0,0,0.0,0,0.0077685500562283795,0.00016598190521744492,0.007934531961445824
1484,The Special Surprise,Jethalal urgently calls all his Gokuldham Friends in Mehta House and also reveals his special surprise plan for Taarak as he could not see him eating the diet food. Jethalal reveals his plan to his Gokuldham Friends. Will Taarak get caught?,19 mins,2020-05-31,0.0,0.0,Gokuldham Society,Sony SAB,,14536358.0,100885.0,1929.0,19.0,0,240,41,4,5.714285714285714,0,1,0,1,0,0,1,1,0,0.0,0,0,0.0,2020.0,5.0,31.0,6.0,2.0,1,6,0,0,0,0.0,240,0.00694018357691909,0.000132701730880477,0.007072885307799566
1485,Keeping A Secret,Jethalal gives a new task to Natu Kaka and Baagha. He tells them to secretly bring the box in Gokuldham society so that no one comes to know about their plan. Taarak is surprised to see the box and Sodhi is shocked as Anjali returns from Bhopal. Will Taarak get caught?,20 mins,2020-05-31,0.0,0.0,Gokuldham Society,Sony SAB,,73395567.0,321555.0,6825.0,20.0,1,269,51,5,5.173076923076923,0,1,0,1,0,0,1,1,0,0.0,0,0,0.0,2020.0,5.0,31.0,6.0,2.0,1,6,0,0,0,0.0,269,0.004381122849270681,9.298926605486587e-05,0.0044741121153255466
1486,The 'Rat' Problem,Taarak's friends hide in Taarak's bedroom as Sodhi reveals to them that Anjali has arrived. Taarak tells Anjali that rats have entered in their bedroom and hence she cannot enter. All the members get trapped in Mehta's Bedroom and Daya assures Anjali that she will remove all the Rats from her house.,19 mins,2020-05-31,0.0,0.0,,Sony SAB,,39201169.0,223123.0,6171.0,19.0,1,300,52,4,5.660377358490566,0,1,0,1,0,0,0,0,0,0.0,0,0,0.0,2020.0,5.0,31.0,6.0,2.0,1,6,0,0,0,0.0,0,0.005691743384189808,0.00015741877091933736,0.005849162155109146
1487,The Master Plan,"Daya, Roshan, Babita, Komal and Anajli know the truth about the rats in Mehta House, all of them come up with a master plan to remove the rats from the house. Will they get caught? Will Anjali forgive Taarak?",19 mins,2020-05-31,0.0,0.0,,Sony SAB,,67306231.0,388477.0,10969.0,19.0,1,208,39,4,5.2,0,1,0,0,0,0,2,1,0,0.0,0,0,0.0,2020.0,5.0,31.0,6.0,2.0,1,6,0,0,0,0.0,416,0.005771783510329326,0.0001629715358304414,0.005934755046159767
1488,Lord Ganesh In Gokuldham,Taarak tries all possible ways to persuade Anjali in front of all the members of Gokuldham Society. Tapu Sena is super excited to bring Lord Ganesha in Gokuldham Society. What will be the theme of Tapu Sena? Watch this episode to find out.,19 mins,2020-05-31,0.0,0.0,Gokuldham Society,Sony SAB,,13883829.0,84575.0,1304.0,19.0,0,239,43,5,5.431818181818182,0,1,1,1,1,0,1,1,0,0.0,0,0,0.0,2020.0,5.0,31.0,6.0,2.0,1,6,0,0,0,0.0,239,0.006091618811235804,9.392221022585266e-05,0.006185541021461657
1489,The Ccompetition Is On,Kids from 7 Star Society challenges Gokuldham Society's Tapu Sena and also tells them that 7-star society will win the award for the best Ganpati decoration. Bhide strictly disagrees to provide a huge fund to Tapu Sena for Ganpati decoration. Will Tapu Sena get a loan from the bank?,18 mins,2020-05-31,0.0,0.0,Gokuldham Society,Sony PAL,,2178418.0,26768.0,411.0,18.0,0,283,49,4,5.66,0,1,0,1,0,0,1,1,0,0.0,0,0,0.0,2020.0,5.0,31.0,6.0,2.0,1,6,0,0,0,0.0,283,0.012287810563532543,0.00018866893834473534,0.01247647950187728
1490,Finding A Solution,"Tappu Sena decides to go to the bank in order to get a loan for Ganpati Puja. But sooner than their expectations they were shown the door. After searching for almost an entire day, they find someone who can help them out, but they have to pay a high price for it.",20 mins,2020-05-31,0.0,0.0,,Sony SAB,,4787276.0,36508.0,736.0,20.0,0,263,52,4,4.962264150943396,0,0,0,0,0,0,0,0,0,0.0,0,0,0.0,2020.0,5.0,31.0,6.0,2.0,1,6,0,0,0,0.0,0,0.007626047124492692,0.00015374084265439413,0.007779787967147086
1491,8 Wonders Of The World,All the members of Gokuldham Society are mesmerized to see the 8 wonders of the world. Tapu Sena is about to reveal their second surprise to Rita Reporter. What is the surprise?,19 mins,2020-05-31,0.0,0.0,Gokuldham Society,Sony SAB,,17338669.0,97023.0,1565.0,19.0,1,177,32,4,5.363636363636363,0,1,0,1,0,0,1,1,0,0.0,0,0,0.0,2020.0,5.0,31.0,6.0,2.0,1,6,0,0,0,0.0,177,0.005595757921455336,9.026067166628121e-05,0.005686018593121618
1492,Time For Promotion,Rita Reporter experiences the magic in Tapu Sena's Gokuldham Ganesh Utsav 2014 and also promotes the same in her news channel. Public from around the city visit Gokuldham society and all of them are experiencing the same.,20 mins,2020-05-31,0.0,0.0,Gokuldham Society,Sony SAB,,47945055.0,271360.0,3904.0,20.0,1,221,37,3,5.815789473684211,0,1,0,1,0,0,0,0,0,0.0,0,0,0.0,2020.0,5.0,31.0,6.0,2.0,1,6,0,0,0,0.0,0,0.0056598119313907985,8.142653957897139e-05,0.00574123847096977
1493,The Special Gifts,All the members of Gokuldham Society are extremely happy that they have got some special gifts from Lord Ganesha. Watch this episode to know the gifts that the members have received.,20 mins,2020-05-31,0.0,0.0,Gokuldham Society,Sony SAB,,9436939.0,65422.0,991.0,20.0,0,182,31,3,5.6875,0,0,1,1,0,0,0,0,0,0.0,0,0,0.0,2020.0,5.0,31.0,6.0,2.0,1,6,0,0,0,0.0,0,0.006932543811871221,0.00010501285374284461,0.007037556665614066
1494,A Special Guest,Kids from 7 Star Society are shocked to see the number of people visiting Gokuldham for it's special Ganpati. Everyone is blessed by their Ganpati and the Gokuldham people feel prosperous. But they are in for a surprise and its a special one.,16 mins,2020-05-31,0.0,0.0,Gokuldham Society,Sony SAB,,8618841.0,61919.0,852.0,16.0,0,242,43,4,5.5,0,0,0,1,0,0,0,0,0,0.0,0,0,0.0,2020.0,5.0,31.0,6.0,2.0,1,6,0,0,0,0.0,0,0.007184143763164471,9.88531870058646e-05,0.007282996950170336
1495,Celebrations Are On Hold,"Chalu Pandey visits the Gokuldham Ganpati Puja and starts his inspection. He goes to Lord Ganpati and asks for the blessings, in return he receives a medal which makes him overwhelmed. Meanwhile, Babita brings Rasgullas for Jethalal.",21 mins,2020-05-31,0.0,0.0,Gokuldham Society,Sony SAB,,8784889.0,69923.0,884.0,21.0,0,233,37,4,6.131578947368421,0,1,0,1,0,0,0,0,0,0.0,0,0,0.0,2020.0,5.0,31.0,6.0,2.0,1,6,0,0,0,0.0,0,0.007959462212958842,0.0001006273271492301,0.008060089540108072
1496,Time To Pay Up,"Gokuldham wins the award for the Best Ganpati Decoration and everyone is excited to hear the news. The next morning they receive the award and appreciation from the judges. But also a warning, as now they have to pay the money back. But little did they know, what fate has left in its store for them.",20 mins,2020-05-31,0.0,0.0,Gokuldham Society,Sony SAB,,19549205.0,100235.0,1706.0,20.0,1,300,56,5,5.2631578947368425,0,0,1,1,0,0,0,0,0,0.0,0,0,0.0,2020.0,5.0,31.0,6.0,2.0,1,6,0,0,0,0.0,0,0.005127318214356123,8.726697135423301e-05,0.005214585185710356
1497,Where Is The Money?,"Tapu Sena finds the donation box completely empty and is shocked to their very core. They check the CCTV footage and find something suspicious in it, but Bagha assures them that it was a technical glitch. Lost all hope, Tapu Sena decides to confront themselves in front of their parents.",20 mins,2020-05-31,0.0,0.0,,Sony SAB,,12948455.0,96476.0,1996.0,20.0,0,287,50,4,5.627450980392157,0,1,0,0,0,0,0,0,0,0.0,0,0,0.0,2020.0,5.0,31.0,6.0,2.0,1,6,0,0,0,0.0,0,0.007450772509092976,0.00015414965305515964,0.007604922162148135
1498,Don't Fear When Ganpati Is Here,"Tapu Sena prays to Lord Ganpati and asks for forgiveness. Lord Ganpati decides to show up in front of Tapu and sends him a clearer message to pursue the goodness in the world. As the time closes, Tapu Sena prays for one last miracle. Will the miracle happen?",20 mins,2020-05-31,0.0,0.0,,Sony SAB,,11601321.0,91338.0,1830.0,20.0,0,258,48,5,5.26530612244898,0,1,0,0,0,0,1,1,0,0.0,0,0,0.0,2020.0,5.0,31.0,6.0,2.0,1,6,0,0,0,0.0,258,0.007873068258944972,0.0001577406436956064,0.008030808902640579
1499,A Unique Gift,"Jethalal gets romantic with Daya and also sings a song for her. All the members of Gokuldham society are extremely happy with the success of Tapu Sena's Ganpati decoration. To know Tapu Sena's special and unique gift, watch this episode.",20 mins,2020-05-31,0.0,0.0,Gokuldham Society,Sony SAB,,15633008.0,114854.0,1916.0,20.0,0,237,40,4,5.780487804878049,0,1,1,1,0,1,0,0,0,0.0,0,0,0.0,2020.0,5.0,31.0,6.0,2.0,1,6,0,0,0,0.0,0,0.0073468901604291275,0.00012256117808158367,0.007469451338510712
1500,The Morning Surprise,Bhide feels bad as Sodhi tells him to leave the job of Secretary of Gokuldham Society. Bhide tells everybody to get ready by 9 AM and also talks about a surprise. What surprise has Bhide planned?,20 mins,2020-05-31,0.0,0.0,Gokuldham Society,Sony SAB,,7085594.0,52086.0,1361.0,20.0,0,195,36,4,5.27027027027027,0,0,0,1,0,0,1,1,0,0.0,0,0,0.0,2020.0,5.0,31.0,6.0,2.0,1,7,0,0,1,0.0,195,0.007350970525411063,0.0001920798465054805,0.0075430503719165435
1501,Gokuldham Society's Celebrations,"As part of Bhide's surprise to the society members, he takes them all to Siddhivinayak for the puja. Later on, all of them go on a Mumbai darshan in an open bus. Everyone in Gokuldham is happy, and thank Bhide while they enjoy the ride. Back home, they all cut the cake and do Garba. Join the celebration.",21 mins,2020-05-27,0.0,0.0,Gokuldham Society,Sony SAB,,6343866.0,52761.0,961.0,21.0,0,305,58,6,5.169491525423729,0,0,1,1,0,0,0,0,0,0.0,0,0,0.0,2020.0,5.0,27.0,2.0,2.0,0,7,0,0,0,0.0,0,0.008316851535506655,0.00015148489084023986,0.008468336426346895
1502,Thanking Bhide For The Trip,All the members of Gokuldham Society express their gratitude towards Bhide for organizing an unforgettable trip. Bhide expresses his gratitude towards Madhvi.,20 mins,2020-05-27,0.0,0.0,Gokuldham Society,Sony SAB,,5597867.0,44463.0,1064.0,20.0,0,158,22,3,6.869565217391305,0,0,0,1,0,0,0,0,0,0.0,0,0,0.0,2020.0,5.0,27.0,2.0,2.0,0,7,0,0,0,0.0,0,0.007942845383278063,0.0001900723632640141,0.008132917746542076
1503,Jethalal Loses The Key,All the members of Gokuldham Society are searching for Jethalal's Key. Iyer comes up with an idea. Will Iyer's idea work?,18 mins,2020-05-27,0.0,0.0,Gokuldham Society,Sony SAB,,7135389.0,51285.0,1485.0,18.0,0,121,21,4,5.5,0,1,0,1,0,0,1,1,0,0.0,0,0,0.0,2020.0,5.0,27.0,2.0,2.0,0,7,0,0,0,0.0,121,0.007187413722305298,0.0002081175661036047,0.007395531288408903
1504,Breaking The Door,Bapuji gets irritated with Jethalal as he lost the key and also gives him an ultimatum to find the key or find the locksmith who can either open or break the door. All efforts have gone in vain. Will Jethalal succeed in finding the key?,20 mins,2020-05-27,0.0,0.0,,Sony SAB,,16530362.0,97738.0,1749.0,20.0,1,236,45,4,5.130434782608695,0,1,0,0,0,0,1,1,0,0.0,0,0,0.0,2020.0,5.0,27.0,2.0,2.0,0,7,0,0,0,0.0,236,0.0059126348284063695,0.00010580529901248992,0.006018440127418859
1505,Finding The Key,"Jethalal Keeps on searching for the key around Gokuldham Society. Meanwhile, Chacha Ji gets worried about Jethalal. Police find them lingering around because of a key, so they send them back to the society.",19 mins,2020-05-27,0.0,0.0,Gokuldham Society,Sony SAB,,13037192.0,102985.0,2183.0,19.0,0,206,34,4,5.885714285714286,0,1,0,1,0,0,0,0,0,0.0,0,0,0.0,2020.0,5.0,27.0,2.0,2.0,0,7,0,0,0,0.0,0,0.007899323113495367,0.00016744401958304983,0.008066767133078417
1506,Celebrating The Joyful Moment,"Everyone in the society is chanting to find the key. Taarak, Bhide, and Jethalal enter the society in search of the key and are quite upset. Tapu finds the key in his pocket and everyone joyfully celebrates the moment.",20 mins,2020-05-27,0.0,0.0,Gokuldham Society,Sony PAL,,9389370.0,66180.0,1249.0,20.0,0,218,39,4,5.45,1,1,0,1,0,0,0,0,0,0.0,0,0,0.0,2020.0,5.0,27.0,2.0,2.0,0,7,0,0,0,0.0,0,0.0070483954675984156,0.00013302275519840465,0.00718141822279682
1507,Newspapers Exchange,"Early morning Bapuji gets a Bengali newspaper, and it ends up being Babita Ji's newspaper. Jethalal gets excited to go to her house to exchange the papers, but Iyer comes home to return the paper first.",20 mins,2020-05-27,0.0,0.0,,Sony SAB,,11146848.0,76616.0,1524.0,20.0,0,202,36,3,5.45945945945946,0,1,1,0,0,0,0,0,0,0.0,0,0,0.0,2020.0,5.0,27.0,2.0,2.0,0,7,0,0,0,0.0,0,0.006873332544470639,0.0001367202516155014,0.007010052796086141
1508,Bagha and Bawri's Mistake,"Bagha and Bawri get special sweets to feed the cow, and mistakenly the Sweetbox gets exchanged and remains in Gada Electronics. Jethalal comes and eats a couple of sweets. When Bagha and Bawri explain this to Jethalal, he gets really angry.",19 mins,2020-05-27,0.0,0.0,,Sony SAB,,8628390.0,72100.0,1361.0,19.0,0,240,41,4,5.714285714285714,1,1,0,0,0,0,0,0,0,0.0,0,0,0.0,2020.0,5.0,27.0,2.0,2.0,0,7,0,0,0,0.0,0,0.008356134996663921,0.0001577350864141414,0.008513870083078062
1509,Surprise For Bapuji,"All the Women from Gokuldham society gather and practice Garba for Navratri. Jethalal calls Daya saying there's a surprise for Bapuji, and Bapuji accidentally hears them talking and gets curious.",20 mins,2020-05-27,0.0,0.0,Gokuldham Society,Sony SAB,,10871603.0,86893.0,1749.0,20.0,0,195,30,3,6.290322580645161,0,1,0,1,0,0,0,0,0,0.0,0,0,0.0,2020.0,5.0,27.0,2.0,2.0,0,7,0,0,0,0.0,0,0.007992656833343083,0.00016087782446822015,0.008153534657811304
1510,Bapuji's Plan,Jethalal gets to know that Bapuji knew about the surprise. Jethalal makes another plan and makes sure it's a secret. Bapuji makes Tapu asks about the surprise. Will Babuji be able to figure out Jethalal's surprise?,20 mins,2020-05-27,0.0,0.0,,Sony SAB,,17533238.0,121934.0,1902.0,20.0,1,214,36,5,5.783783783783784,0,1,0,0,0,0,1,1,0,0.0,0,0,0.0,2020.0,5.0,27.0,2.0,2.0,0,7,0,0,0,0.0,214,0.0069544480629049775,0.0001084796710978502,0.007062927734002827
1511,Bapuji Gets Worried,"Bhide is helping Jethalal to Surprise Bapuji. Meanwhile,  Bapuji waits all night to know the surprise. Watch the episode to find out what the surprise is.",20 mins,2020-05-27,0.0,0.0,,Sony SAB,,12280540.0,106379.0,2037.0,20.0,0,154,26,4,5.703703703703703,0,1,0,0,1,0,0,0,0,0.0,0,0,0.0,2020.0,5.0,27.0,2.0,2.0,0,7,0,0,0,0.0,0,0.008662403390860387,0.00016587217126672187,0.008828275562127109
1512,The Big Surprise,100s of cyclists arrive in Gokuldham society who goes to Temple every year by cycling. This time they will start their journey with a green flag by Bapuji. Everyone in the society gets happy and excited.,20 mins,2020-05-27,0.0,0.0,Gokuldham Society,Sony PAL,,4967323.0,58095.0,541.0,20.0,0,203,36,4,5.486486486486487,0,0,1,1,0,0,0,0,0,0.0,0,0,0.0,2020.0,5.0,27.0,2.0,2.0,0,7,0,0,0,0.0,0,0.01169543198712224,0.00010891176013483316,0.011804343747257074
1513,Discussing About The Competition,"Bapuji gets happy with the surprise and gives ancestors belonging. Jethalal and the family members get really happy, Later all women gather to discuss the yearly competition.",19 mins,2020-05-27,0.0,0.0,,Sony SAB,,6196582.0,43644.0,912.0,19.0,0,174,27,3,6.214285714285714,0,1,1,1,0,1,0,0,0,0.0,0,0,0.0,2020.0,5.0,27.0,2.0,2.0,0,7,0,0,0,0.0,0,0.007043236570864943,0.0001471778882006422,0.007190414459065585
1514,Navratri Celebrations,Bhide and Tapu Sena get the tattoo artists to Gokuldham society for the Navratri celebration. Everyone starts the preparations for Navratri.,20 mins,2020-05-27,0.0,0.0,Gokuldham Society,Sony SAB,,20505390.0,100669.0,2065.0,20.0,1,140,21,3,6.363636363636363,0,1,0,1,0,0,0,0,0,0.0,0,0,0.0,2020.0,5.0,27.0,2.0,2.0,0,7,0,0,0,0.0,0,0.004909391876507012,0.00010070522429930743,0.00501009710080632
1515,Navratri Night,"Jethalal calls his shop and Bawri picks up the call. Jethalal starts ranting on Bagha, and then Daya takes the phone to invites Bhaga and Bawri for the Garba night. Jethalal gets a special tattoo and is excited about it.",20 mins,2020-05-27,0.0,0.0,,Sony SAB,,4254937.0,28455.0,911.0,20.0,0,220,40,4,5.365853658536586,0,1,1,0,0,0,0,0,0,0.0,0,0,0.0,2020.0,5.0,27.0,2.0,2.0,0,7,0,0,0,0.0,0,0.006687524001524817,0.00021410417731116177,0.006901628178835978
1516,Special Guests Arrive,"Special guests arrive in Gokuldham society, and the Garba night begins where everyone enjoys and cherishes the moment.",20 mins,2020-05-27,0.0,0.0,Gokuldham Society,Sony SAB,,13878014.0,110589.0,2027.0,20.0,0,118,18,2,6.2105263157894735,0,0,0,1,0,0,0,0,0,0.0,0,0,0.0,2020.0,5.0,27.0,2.0,2.0,0,7,0,0,0,0.0,0,0.007968646812962804,0.0001460583520049517,0.008114705164967756
1517,Jethalal Completes His Work,"Jethalal tends to forget things at home. When Bapuji lost a button of his kurta, he asks Jethalal for help. Jethalal struggles to find the thread and needle and even struggles to complete his work. Bapuji gets happy thinking Jethalal completed the work.",19 mins,2020-05-27,0.0,0.0,,Sony SAB,,5911343.0,42977.0,719.0,19.0,0,253,43,5,5.75,0,1,1,0,0,0,0,0,0,0.0,0,0,0.0,2020.0,5.0,27.0,2.0,2.0,0,7,0,0,0,0.0,0,0.007270258675522859,0.0001216305462852441,0.007391889221808104
1518,Daya's Colorful plan,"Daya is singing a song and asks Jethalal to decode it. Later, she says that they should color their house for this Deepawali. Meanwhile, Bhide fights with his wife regarding the food.",19 mins,2020-05-27,0.0,0.0,,Sony SAB,,11382672.0,71471.0,1549.0,19.0,0,183,32,4,5.545454545454546,1,1,0,0,0,1,0,0,0,0.0,0,0,0.0,2020.0,5.0,27.0,2.0,2.0,0,7,0,0,0,0.0,0,0.006278929386796932,0.0001360840287689895,0.006415013415565922
1519,Jethalal's Day Off,"Jethalal takes a day off and gets a call from Daya. She informs him that someone has come home and is waiting for him. Later, when Jethalal is sleeping, Daya disguised as a Terrorist, wakes him up, and he gets astonished.",19 mins,2020-05-27,0.0,0.0,,Sony SAB,,14743130.0,86653.0,2380.0,19.0,0,221,41,4,5.261904761904762,0,1,0,0,0,0,0,0,0,0.0,0,0,0.0,2020.0,5.0,27.0,2.0,2.0,0,7,0,0,0,0.0,0,0.0058775167907006995,0.00016143110985041101,0.0060389479005511105
1520,Jethalal Cleans His House,Jethalal is forced to clean the house and is cursing in front of Bapuji. Jethalal tries to make a scene to make them stop his work but ends up making a mess.,20 mins,2020-05-27,0.0,0.0,,Sony PAL,,14219608.0,107466.0,2088.0,20.0,0,157,32,3,4.757575757575758,0,1,0,0,0,0,0,0,0,0.0,0,0,0.0,2020.0,5.0,27.0,2.0,2.0,0,7,0,0,0,0.0,0,0.007557591773444685,0.00014683948060737818,0.007704431254052063
1521,The Cleaning Situation,"Babita forces Iyer to clean the house, and Iyer is sad about it. He tries to make a scene to get rid of the work. Meanwhile, there is a similar situation in everyone's home.",20 mins,2020-05-27,0.0,0.0,,Sony SAB,,13076594.0,92763.0,1496.0,20.0,0,173,34,4,4.942857142857143,0,1,1,0,0,0,0,0,0,0.0,0,0,0.0,2020.0,5.0,27.0,2.0,2.0,0,7,0,0,0,0.0,0,0.007093819147874504,0.00011440287016612505,0.007208222018040629
1522,The Big Mistake,All the Men from Gokuldham society are fed up with the cleaning work. Everyone gathers while taking the trash out and ends up chit-chatting amongst each other.,19 mins,2020-05-27,0.0,0.0,Gokuldham Society,Sony SAB,,28678771.0,169496.0,2757.0,19.0,1,159,27,3,5.678571428571429,0,0,0,1,0,0,0,0,0,0.0,0,0,0.0,2020.0,5.0,27.0,2.0,2.0,0,7,0,0,0,0.0,0,0.005910155427854442,9.613382330317352e-05,0.006006289251157616
1523,Making A Mess,"All the Men threw the trash in the Society.  It ends up lingering around and the society looks like a mess. Later, they realize that it is their own mistake.",20 mins,2020-05-27,0.0,0.0,Gokuldham Society,Sony SAB,,15583986.0,134528.0,3298.0,20.0,0,157,30,4,5.064516129032258,0,0,0,1,0,0,0,0,0,0.0,0,0,0.0,2020.0,5.0,27.0,2.0,2.0,0,7,0,0,0,0.0,0,0.008632450732922198,0.00021162748659890438,0.008844078219521103
1524,Taking The initiative,When all the members of the society realize it's their own mistake because of which the society looks like a mess. They take up the initiative to clean the surrounding.,20 mins,2020-05-27,0.0,0.0,Gokuldham Society,Sony SAB,,10884981.0,74646.0,1884.0,20.0,0,168,30,3,5.419354838709677,0,0,0,1,0,0,0,0,0,0.0,0,0,0.0,2020.0,5.0,27.0,2.0,2.0,0,7,0,0,0,0.0,0,0.006857705414671333,0.00017308250946120076,0.0070307879241325345
1525,Diwali Meeting,"Daya makes delicious food, which makes Jethalal happy. Daya then requests to arrange the Diwali meeting at their place. Jethalal agrees and contacts Bhide. what happens in the meeting? Watch the episode to find out.",19 mins,2020-05-27,0.0,0.0,,Sony SAB,,6085768.0,53466.0,871.0,19.0,0,215,35,6,5.972222222222222,0,1,1,1,1,0,1,1,0,0.0,0,0,0.0,2020.0,5.0,27.0,2.0,2.0,0,7,0,0,0,0.0,215,0.008785413971512885,0.00014312077898454576,0.008928534750497432
