episode_no,episode_title,description,episode_runtime,released_on,lead_cast_matches,supporting_cast_matches,place_matches_cleaned,channel_title,publish_date,view_count,like_count,comment_count,runtime_minutes,is_successful,desc_length,desc_word_count,desc_sentence_count,avg_word_length,has_conflict,has_main_char,has_emotion,has_society,has_mystery,has_family,question_count,has_question,exclamation_count,total_cast,has_lead_cast,has_supporting_cast,cast_ratio,release_year,release_month,release_day,release_day_of_week,release_quarter,is_weekend,estimated_season,is_pilot,is_early_episode,is_milestone,cast_x_runtime,desc_length_x_questions,like_rate,comment_rate,engagement_rate
475,Sodhi Gives The Token Amount,"Bhide and Sodhi go for a ride when Bhide tells him about the flat. Sodhi is ready to buy the flat and gives the token amount. Meanwhile, Daya informs his brother, Sundar about the new flat that they are buying. What will Sundar do now?",18 mins,2020-01-10,0.0,0.0,,Sony SAB,,8772176.0,91538.0,1202.0,18.0,0,235,45,5,5.108695652173913,0,1,0,0,1,0,1,1,0,0.0,0,0,0.0,2020.0,1.0,10.0,4.0,1.0,0,2,0,0,0,0.0,235,0.010435037961500322,0.00013702413893381312,0.010572062100434133
476,All The Gifts For Bhide,"Bhide finds himself in a tough situation with Sodhi and Jethalal, both giving him the token amount for the flat. He tries to convince Jethalal to back out of the deal. Meanwhile, Madhavi takes the step to convince Sodhi. Will they succeed?",19 mins,2020-01-10,0.0,0.0,,Sony SAB,,6310574.0,72859.0,1418.0,19.0,0,239,42,5,5.558139534883721,0,1,0,0,0,0,1,1,0,0.0,0,0,0.0,2020.0,1.0,10.0,4.0,1.0,0,2,0,0,0,0.0,239,0.011545540620307975,0.00022470218640932086,0.011770242806717296
477,Who Will Get The Flat?,"Chanda Ramani's flat is on sale and Sodhi, as well as Jethalal, wants to buy it. They both have paid to token money to Bhide and Madhvi. Now the problem is none of them is wanting to back off and let go of the flat. Bhide is in great confusion and distress as to who should get the flat.",18 mins,2020-01-10,0.0,0.0,,Sony SAB,,5674762.0,72396.0,1267.0,18.0,0,287,59,5,4.783333333333333,1,1,0,0,0,0,0,0,0,0.0,0,0,0.0,2020.0,1.0,10.0,4.0,1.0,0,2,0,0,0,0.0,0,0.012757537187015564,0.0002232692360896834,0.012980806423105246
478,Jethalal And Sodhi's Irrationality,Bhide is sandwiched between Jethalal and Sodhi's demands. Their irrational behaviour has led to big trouble for Bhide. Whereas the children and women of Gokuldham seem to be more sensible than the two fighting for the flat.,17 mins,2020-01-10,0.0,0.0,Gokuldham Society,Sony SAB,,9456742.0,115735.0,1806.0,17.0,0,223,37,4,5.868421052631579,1,1,0,1,0,0,0,0,0,0.0,0,0,0.0,2020.0,1.0,10.0,4.0,1.0,0,2,0,0,0,0.0,0,0.012238357328733582,0.00019097484197254806,0.01242933217070613
479,Bhide Is No Longer The Middleman,"Finally, Chanda Ramani calls Bhide back for the updates on his apartment. Bhide explains him everything and after listening, he decides to hold an auction, whoever bids the highest, gets the apartment. Bhide conveys this news to both of them and as an addition, Iyer claims even he would bid for it. Stay tuned to find out more.",19 mins,2020-01-10,0.0,0.0,,Sony SAB,,30950267.0,344656.0,5534.0,19.0,1,328,58,5,5.559322033898305,0,1,0,0,1,0,0,0,0,0.0,0,0,0.0,2020.0,1.0,10.0,4.0,1.0,0,2,0,0,0,0.0,0,0.011135800181116364,0.00017880297514709728,0.011314603156263462
480,Auction Day At Gokuldham,"Chanda Ramami finally arrives at Gokuldham for the auction and meets everyone after a long time. In due course, the auction begins with Jethalal bidding first. It carries on for a while. The person who bids the highest astonishes everyone. Who is this person? Find out in this episode.",16 mins,2020-01-10,0.0,0.0,Gokuldham Society,Sony SAB,,19668763.0,288449.0,6559.0,16.0,1,285,49,7,5.7,0,1,0,1,1,1,1,1,0,0.0,0,0,0.0,2020.0,1.0,10.0,4.0,1.0,0,2,0,0,0,0.0,285,0.014665334334175752,0.0003334729116684709,0.014998807245844223
481,Popatlal's Withdrawal,"As the bidding for the flat at Gokuldham continues, Tarak realises that the highest bid is by Popatlal at 60 Lakhs. He announces Popatlal to be the winner of the Auction and asks him to pay 11 Lakhs as an advance payment. After listening to the amount, Popatlal withdraws his bid.",18 mins,2020-06-30,0.0,0.0,Gokuldham Society,Sony SAB,,26507243.0,212251.0,2727.0,18.0,1,280,51,4,5.384615384615385,0,1,0,1,0,0,0,0,0,0.0,0,0,0.0,2020.0,6.0,30.0,1.0,2.0,0,2,0,0,0,0.0,0,0.008007282839362704,0.0001028775379288771,0.008110160377291582
482,Goli Misses His Father,"All the kids have gathered around to play with the gifts they received during Diwali. However, Goli gets upset because he did not receive any gifts from his father. Stay tuned to find out more.",20 mins,2020-06-30,0.0,0.0,,Sony SAB,,18147046.0,187427.0,2797.0,20.0,1,193,35,4,5.361111111111111,1,0,0,0,1,1,0,0,0,0.0,0,0,0.0,2020.0,6.0,30.0,1.0,2.0,0,2,0,0,0,0.0,0,0.010328236875123539,0.00015412976006509488,0.010482366635188634
483,Komal Worries About Goli,"Komal is worried about Goli and his mission to increase weight. Unsure of what to do next, She goes to Tarak Mehta for advice. Will Tarak be able to help Komal? Find out in this episode.",22 mins,2020-06-30,0.0,0.0,,Sony SAB,,23387440.0,200834.0,2904.0,22.0,1,186,36,5,5.027027027027027,0,0,0,0,1,0,1,1,0,0.0,0,0,0.0,2020.0,6.0,30.0,1.0,2.0,0,2,0,0,0,0.0,186,0.008587258434986538,0.00012416920688330116,0.00871142764186984
484,Jethalal's Gastric Problem,"Jethalal is having gastric issues where he feels bloated and is unable to walk. Daya comes to his rescue and thinks of an idea in an attempt to help him out in his misery. Meanwhile, Bhide gets a cold from all the extra soda he drank and goes to the Hathi brothers for treatment.",21 mins,2020-06-30,0.0,0.0,,Sony SAB,,57879621.0,428248.0,4804.0,21.0,1,279,54,4,5.072727272727272,0,1,0,0,0,0,0,0,0,0.0,0,0,0.0,2020.0,6.0,30.0,1.0,2.0,0,2,0,0,0,0.0,0,0.007398942584663044,8.29998509665457e-05,0.00748194243562959
485,Jethalal And Taarak's Misery,The men of the society are disappointed with what their wives have offered them for breakfast. Taarak and Jetha are the main victims who feel despondent about the fact that one brings boring food on the table and one delays the breakfast. Keep watching the episode to find out more.,20 mins,2020-06-30,0.0,0.0,Gokuldham Society,Sony SAB,,11014929.0,119574.0,1813.0,20.0,0,282,50,4,5.529411764705882,0,0,0,1,1,0,0,0,0,0.0,0,0,0.0,2020.0,6.0,30.0,1.0,2.0,0,2,0,0,0,0.0,0,0.010855629586388657,0.00016459478180978,0.011020224368198436
486,Krishnaben Khakhrawala In Gokuldham,"The famous Krishnaben arrives in Gokuldham with her 'khakhras'. Daya gets excited after seeing her and everyone praises her for the taste of her khakras. Later, Taarak and Anjali have a little fight over a petty issue. Stay tuned to find out more.",21 mins,2020-01-10,0.0,0.0,Gokuldham Society,Sony PAL,,6328093.0,53391.0,1130.0,21.0,0,247,43,5,5.613636363636363,1,1,1,1,1,0,0,0,0,0.0,0,0,0.0,2020.0,1.0,10.0,4.0,1.0,0,2,0,0,0,0.0,0,0.008437137627854453,0.00017856877600111503,0.008615706403855568
487,Jethalal's Suit,"Jethalal's suit does not fit him but it's not the same with Daya. Champaklal hurts his feet while climbing the stairs and screams, listening to which everybody comes to his rescue. Seeing the Gada couple in that attire, all are stunned. All of them make fun of Jethalal and compliments Daya on looking pretty. The next day, Daya mistakenly pours tea over Jethalal's important cheque, he is furious.",21 mins,2020-01-10,0.0,0.0,,Sony SAB,,23412098.0,234777.0,4902.0,21.0,1,398,68,6,5.768115942028985,0,1,0,0,0,0,0,0,0,0.0,0,0,0.0,2020.0,1.0,10.0,4.0,1.0,0,2,0,0,0,0.0,0,0.010028020127541747,0.00020937891984823746,0.010237399047389984
488,Daya Takes A Stand,"Daya unintentionally spoils the important cheque by spilling some tea on it. In his anger, Jethalal throws some mean and harsh comments towards his wife. Daya gets upset but later takes a stand to be not looked down upon. Keep watching to find out more.",18 mins,2020-01-10,0.0,0.0,,Sony SAB,,22846883.0,202502.0,3283.0,18.0,1,253,45,5,5.5,1,1,0,0,1,1,0,0,0,0.0,0,0,0.0,2020.0,1.0,10.0,4.0,1.0,0,2,0,0,0,0.0,0,0.008863440633742439,0.0001436957442424096,0.009007136377984849
489,It's Not That Easy,Jethalal called Daya several times but she did not pick up the call. He rushes home to ask for forgiveness but Daya is not going to open the door. Now Jethalal must look for other ways to make it up to his wife and get her to forgive him.,18 mins,2020-01-10,0.0,0.0,,Sony SAB,,23408945.0,207699.0,3479.0,18.0,1,238,49,4,4.76,0,1,0,0,0,1,0,0,0,0.0,0,0,0.0,2020.0,1.0,10.0,4.0,1.0,0,2,0,0,0,0.0,0,0.008872633564962729,0.00014861839571931175,0.00902125196068204
490,Gokuldham Struggles With Jethalal,"In due course of time, all of Gokuldham suspects the weird behaviour of Jethalal and finally gets to know about the whole situation. Everybody decides to help him out and get Daya to open the door. Meanwhile, Taarak gets an idea to climb up a ladder and open the balcony door. Stay tuned to find out more.",21 mins,2020-01-10,0.0,0.0,Gokuldham Society,Sony SAB,,17884970.0,174223.0,2447.0,21.0,1,305,57,5,5.258620689655173,0,1,0,1,1,0,0,0,0,0.0,0,0,0.0,2020.0,1.0,10.0,4.0,1.0,0,2,0,0,0,0.0,0,0.009741307380369808,0.0001368187848892794,0.009878126165259089
491,A Sorry Solves Everything,"The last option that remains now is to break the door and get inside. Sodhi decides to do the deed. He finally breaks in with all his power. Entering the house, they find Daya asleep as she had some cough syrup. Jethalal wakes her up and apologizes to her.",20 mins,2020-01-10,0.0,0.0,,Sony SAB,,6886070.0,71616.0,1116.0,20.0,0,256,49,6,5.12,0,1,0,0,0,0,0,0,0,0.0,0,0,0.0,2020.0,1.0,10.0,4.0,1.0,0,2,0,0,0,0.0,0,0.010400125122148754,0.0001620662929557363,0.010562191415104491
492,Tapu Sena Is Confused,"Tapu Sena is enjoying their vacation. While playing cricket in the compound, they encounter a lot of problems with the rest of the society members. Tapu Sena goes to Taarak to ask for his advice as they are confused as to what to do.",20 mins,2020-01-10,0.0,0.0,Gokuldham Society,Sony SAB,,11394871.0,118970.0,1666.0,20.0,0,233,44,4,5.177777777777778,1,1,0,1,0,0,0,0,0,0.0,0,0,0.0,2020.0,1.0,10.0,4.0,1.0,0,2,0,0,0,0.0,0,0.010440661378205917,0.00014620611798008787,0.010586867496186004
493,Magic Show In Gokuldham,"Tapu Sena informs Bhide about the magic show organized by Taarak. The kids along with the society members are excited about the magic show. Later, the famous magician Munnalal arrives at Gokuldham for his magical performance. Keep watching the show to find out more.",21 mins,2020-01-10,0.0,0.0,Gokuldham Society,Sony SAB,,6024464.0,62587.0,681.0,21.0,0,266,44,5,5.911111111111111,0,1,1,1,1,0,0,0,0,0.0,0,0,0.0,2020.0,1.0,10.0,4.0,1.0,0,2,0,0,0,0.0,0,0.010388806308941956,0.00011303908313850276,0.01050184539208046
494,The Magical Munnalal,The magician Munnalal starts showing off his talent and everyone is having a great time at his show. He involves some of the society members as well in his magic tricks. It seems Tapu Sena has finally found the change they were looking for.,21 mins,2020-01-10,0.0,0.0,Gokuldham Society,Sony SAB,,12039122.0,94176.0,1259.0,21.0,0,240,44,4,5.333333333333333,0,1,0,1,0,0,0,0,0,0.0,0,0,0.0,2020.0,1.0,10.0,4.0,1.0,0,2,0,0,0,0.0,0,0.007822496705117142,0.00010457572366359244,0.007927072428780733
495,Tapu Sena Wants To Learn Magic,The Magic show in Gokuldham society continues. Everyone is participating and are captivated by all the magical tricks. Tapu Sena is deeply influenced by the magician and wants to learn magic from him. Stay tuned to find out more.,18 mins,2020-01-10,0.0,0.0,Gokuldham Society,Sony SAB,,7307437.0,74226.0,921.0,18.0,0,229,39,5,5.725,0,1,0,1,1,0,0,0,0,0.0,0,0,0.0,2020.0,1.0,10.0,4.0,1.0,0,2,0,0,0,0.0,0,0.010157595589589676,0.00012603596499895039,0.010283631554588626
496,Tapu Sena's New Tricks,"Tapu Sena goes to learn magic from Munnalal and he teaches them some special tricks. Tapu Sena then presents the magic they learnt to all the society members, everybody is fascinated after seeing it. Keep watching to find out more.",19 mins,2020-01-10,0.0,0.0,Gokuldham Society,Sony SAB,,17680974.0,144163.0,1431.0,19.0,1,231,40,4,5.634146341463414,0,1,0,1,1,0,0,0,0,0.0,0,0,0.0,2020.0,1.0,10.0,4.0,1.0,0,2,0,0,0,0.0,0,0.008153566191909666,8.093445073023406e-05,0.0082345006426399
497,Madhavi's Money,"In the process of showing off their magic to everybody, Tapu Sena by mistake misplaces Madhavi's money and she becomes mad at them. Bhide makes a big scene in the society regarding the money. Everyone is busy searching for the money and Champaklal has called the police to investigate.",21 mins,2020-01-10,0.0,0.0,Gokuldham Society,Sony SAB,,15907929.0,142304.0,1853.0,21.0,0,285,49,4,5.7,0,1,0,1,0,0,0,0,0,0.0,0,0,0.0,2020.0,1.0,10.0,4.0,1.0,0,2,0,0,0,0.0,0,0.008945475621278193,0.00011648278562955708,0.009061958406907749
498,Dr. Hathi Is Back,"Jethalal accuses Taarak and makes him the reason for Tapu Sena's mistake. Tapu is scared of the police and begs his parents that he will not repeat the mistake. Meanwhile, Dr Hathi returns from the Naturo Camp but he hasn't changed a bit in all this time.",22 mins,2020-01-10,0.0,0.0,,Sony SAB,,11744690.0,107498.0,2571.0,22.0,0,255,47,4,5.3125,0,1,1,0,0,1,0,0,0,0.0,0,0,0.0,2020.0,1.0,10.0,4.0,1.0,0,2,0,0,0,0.0,0,0.009152901510989093,0.00021890741953108856,0.00937180893052018
499,Champaklal Disciplines Jethalal,Jethalal is trying to romance his wife but Champaklal's presence prevents him from doing so. He also tells Jethalal to take care of his health and scolds him about his lifestyle. Stay tuned to find out more.,19 mins,2020-01-10,0.0,0.0,,Sony SAB,,21300197.0,216783.0,3174.0,19.0,1,207,37,4,5.447368421052632,0,1,0,0,1,1,0,0,0,0.0,0,0,0.0,2020.0,1.0,10.0,4.0,1.0,0,2,0,0,0,0.0,0,0.010177511025953843,0.0001490126993185697,0.010326523725272412
1000,Natu Kaka's Unique Way To Convince Jethalal To Increase His Salary,"Dhukhmanjan Maharaj reveals Jethalal that the puja that he has organized to get rid of his brother-in-law is successfully completed and also assures him that henceforth, Sundar will never ever create trouble for him, but a major trouble takes place as Daya and Anjali come to know about Jethalal's Sala Shati Hawan and Sundar too arrives with her sister. Natu Kaka tries unique ways to convince Jethalal to increase his salary. Will Jethalal increase Natu Kaka's salary?",19 mins,2012-11-06,0.0,0.0,,Sony PAL,,4603575.0,47535.0,793.0,19.0,0,470,77,4,6.0256410256410255,1,1,0,0,0,0,1,1,0,0.0,0,0,0.0,2012.0,11.0,6.0,1.0,4.0,0,5,0,0,1,0.0,470,0.01032566856721818,0.00017225739294843834,0.010497925960166618
1001,Jeannie Gets A Difficult Task From Popatlal,"Popatlal gets surprised to see Jeannie in Gokuldham and  requests her to find a gorgeous girl for him so that he can marry. Jeannie introduces Mini to Popatlal, but it was all in Popatlal's dream. Popatlal insistsTaarak Mehta to find a girl for him, as he cannot think of anything else except his marriage. Daya shares her dream with Bapuji and Tapu and also reveals that she is getting an intuition, something really good is going to happen. Will Daya's predictions come true?",17 mins,2012-11-07,0.0,0.0,Gokuldham Society,Sony PAL,,2067686.0,22717.0,453.0,17.0,0,477,83,6,5.678571428571429,0,1,1,1,0,0,1,1,0,0.0,0,0,0.0,2012.0,11.0,7.0,2.0,4.0,0,5,0,0,0,0.0,477,0.010986672547634144,0.0002190853838129272,0.01120575793144707
1002,Bapuji Surprised To Meet The Star Cast Of Son Of Sardar,"Daya informs Jethalal that soon something good is going to happen. Producer of Taarak Mehta Ka Ooltah Chashmah Asitkumarr Modi forces Bapuji to come along with him and takes him to a restaurant where he not only meets the Director of the film Son Of Sardar but also meets Actor Ajay Devgan and Sonakshi Sinha too. Later, Ajay Devgan informs Daya that he is soon going to surprise her and Sonakshi Sinha too calls Jethalal.",19 mins,2012-11-08,0.0,0.0,,Sony PAL,,4886445.0,50179.0,625.0,19.0,0,422,75,4,5.552631578947368,0,1,0,0,0,1,0,0,0,0.0,0,0,0.0,2012.0,11.0,8.0,3.0,4.0,0,5,0,0,0,0.0,0,0.010269017605024184,0.0001279048208043228,0.010396922425828506
1003,Ajay Devgn's Unique Way Of Informing Good News To Colony Members,"Ajay Devgn informs Tapu to be prepared in the morning with his friends as a huge surprise is waiting for them and Bhide gets tensed later, Ajay Devgn and Sonakshi Sinha inform Dr. Hatthi in a unique way by writing a message on the cake as he loves to eat. Sodhi too gets an invitation card from an unknown person. In Gada electronics, Natu Kaka and Baagha too get the same message that he gave to all the colony members.",17 mins,2012-11-09,0.0,0.0,,Sony PAL,,3586225.0,38037.0,681.0,17.0,0,420,80,5,5.185185185185185,0,1,0,1,0,1,0,0,0,0.0,0,0,0.0,2012.0,11.0,9.0,4.0,4.0,0,5,0,0,0,0.0,0,0.010606414654291168,0.00018989321922265913,0.010796307873513827
1004,An Unknown Biker Handovers A Letter To Babita,Jethalal shares all the strange incidents that took place with him with Baagha and Natu Kaka and also tries to find out the unknown person Taarak too receives a unique mail and confirms the same with Jethalal. All the members of Gokuldham Society gather in their compound to discuss strange invitations that they are receiving from an unknown person. A biker arrives in the colony and handovers a letter of invitation to Babita. Jethalal advises all the members to skip the activity.,19 mins,2012-11-12,0.0,0.0,Gokuldham Society,Sony PAL,,13296315.0,98279.0,1743.0,19.0,0,483,82,5,5.819277108433735,0,1,0,1,1,1,0,0,0,0.0,0,0,0.0,2012.0,11.0,12.0,0.0,4.0,0,5,0,0,0,0.0,0,0.007391445871172135,0.00013108894223031402,0.0075225348134024496
1005,Tapu Sena's Mind,"Tapu Sena informs all the members of Gokuldham Society about Project Roshni and also collects donations from all the members. All the members of Gokuldham society appreciate Tapu Sena's efforts as they all are working for a noble cause. Later, Tapu Sena gets upset, as instead of collecting Rs. 25,000 they have managed to collect only Rs.1850. Tapu finds his loopholes and decides to find an alternate way to achieve the target.",19 mins,2012-11-13,0.0,0.0,Gokuldham Society,Sony PAL,,6260878.0,48652.0,957.0,19.0,0,429,72,7,5.876712328767123,1,1,0,1,0,0,0,0,0,0.0,0,0,0.0,2012.0,11.0,13.0,1.0,4.0,0,5,0,0,0,0.0,0,0.007770793845400941,0.00015285393632427652,0.007923647781725218
1006,Gokuldham Members Meet The Star Cast Of Son Of Sardar,"Members of Gokuldham Society are still not able to track the kidnapper. Later, two unknown people arrive in Gokuldham society and Sodhi assumes them as kidnappers.  Announcer orders them to pray to Lord Krishna and Bapuji finally arrives in Gokuldham Society. All the members of Gokuldham Society are surprised to meet the star cast of Son Of Sardar. Popatlal gets mesmerized to see Sonakshi Sinha.",20 mins,2012-11-14,0.0,0.0,Gokuldham Society,Sony PAL,,2270186.0,21176.0,563.0,20.0,0,398,65,6,6.03030303030303,0,1,0,1,0,1,0,0,0,0.0,0,0,0.0,2012.0,11.0,14.0,2.0,4.0,0,5,0,0,0,0.0,0,0.00932786594232105,0.00024799719142079487,0.009575863133741846
1007,Taarak Mehta Celebrates 1000 Episodes With Actor Ajay Devgn And Sonakshi Sinha,All the members of Gokuldham society are trying hard to recollect what they are forgetting. Ajay Devgn and Sonakshi Sinha remind them about the completion of 1000 glorious episodes of their longest running comedy series Taarak Mehta Ka Ooltah Chashmah. They also invite the whole team of Taarak Mehta ka ooltah Chashmah and all the members of Gokuldham society decide to watch  Ajay Devgn and Sonakshi Sinha's Son of Sardar.,20 mins,2012-11-15,0.0,0.0,Gokuldham Society,Sony PAL,,1238080.0,12981.0,336.0,20.0,0,424,70,4,5.971830985915493,0,0,0,1,0,1,0,0,0,0.0,0,0,0.0,2012.0,11.0,15.0,3.0,4.0,0,5,0,0,0,0.0,0,0.010484774421059688,0.0002713877363435833,0.010756162157403272
1008,Producer Asitkumarr Modi Gives A Unique Surprise,"Celebrations continue as Ajay Devgan and Sonakshi Sinha dance to the hit tunes of their upcoming film Son of Sardar and also play Garba with Daya and other Gokuldham members. Later, producer Asitkumarr Modi gives two surprises back to back and also spreads the message of love and happiness in a unique way.",18 mins,2012-11-16,0.0,0.0,Gokuldham Society,Sony PAL,,1238782.0,13957.0,290.0,18.0,0,307,53,3,5.685185185185185,0,1,0,1,0,1,0,0,0,0.0,0,0,0.0,2012.0,11.0,16.0,4.0,4.0,0,5,0,0,0,0.0,0,0.011266702885008917,0.0002341007262773222,0.011500803611286237
1009,Taarak Mehta And His Whole Team Worship Goddess Amba,"All the members of Gokuldham society are having a rocking time together in Shakti Dwar. They are not only exploring the place but are also worshiping Goddess Amba and seeking her blessings too. After an unforgettable religious trip, all the members of Gokuldham Society have come back to the society where Daya is trying her best to wake up Jethalal who is in deep sleep.",19 mins,2012-11-19,0.0,0.0,Gokuldham Society,Sony PAL,,2489876.0,26402.0,490.0,19.0,0,371,65,4,5.621212121212121,0,1,0,1,0,0,0,0,0,0.0,0,0,0.0,2012.0,11.0,19.0,0.0,4.0,0,5,0,0,0,0.0,0,0.010603736650444982,0.00019679686988554053,0.010800533520330523
1010,Tapu Sena Firmly Decide To Collect Rs,"Principal informs the Children about Project Roshni in which all the Children will work together in a group and collect donations for those Children who cannot see the world and excited Tapu tells his Principal and Teacher that his group will collect the highest donations. Teacher informs them that the group who will collect the highest donations will get 10 marks from the school followed by a trophy too. Will Tapu Sena succeed in collecting Rs. 25,000 for Project Roshni?",18 mins,2012-11-20,0.0,0.0,,Sony PAL,,1960499.0,22972.0,410.0,18.0,0,476,80,5,5.8765432098765435,0,1,1,0,0,0,1,1,0,0.0,0,0,0.0,2012.0,11.0,20.0,1.0,4.0,0,5,0,0,0,0.0,476,0.011717419025758735,0.00020913032389696505,0.0119265493496557
1011,Tapu Sena's Mind,"Tapu Sena informs all the members of Gokuldham society about Project Roshni and also collects donations from all the members. All the members of Gokuldham society appreciate Tapu Senas efforts as they all are working for a noble cause, Tapu Sena gets upset as instead of collecting Rs. 25,000 they have managed to collect only Rs. 1850. Tapu finds his loop holes and decides to find an alternate way to achieve their target.",20 mins,2012-11-21,0.0,0.0,Gokuldham Society,Sony PAL,,2281404.0,27217.0,404.0,20.0,0,424,73,6,5.72972972972973,1,1,0,1,0,0,0,0,0,0.0,0,0,0.0,2012.0,11.0,21.0,2.0,4.0,0,5,0,0,0,0.0,0,0.011929929144540316,0.000177083858411812,0.012107013002952128
1012,Tapu Sena Involve 2 Members In Their Secret Plan,"Inspired from Tapu, Baagha and Natu Kaka too decide to collect donations for a Gaushala project. Tapu sena firmly decide to keep their program a secret. Tapu sena involves Abdul and Baagha in their secret plan. Jethalal has given a task to Baagha and Baagha rushes to meet Tapu.",17 mins,2012-11-22,0.0,0.0,,Sony PAL,,4723456.0,52633.0,1159.0,17.0,0,278,49,5,5.56,0,1,0,0,0,0,0,0,0,0.0,0,0,0.0,2012.0,11.0,22.0,3.0,4.0,0,5,0,0,0,0.0,0,0.011142898093493812,0.000245371133896212,0.011388269227390025
1013,Tapu Sena's Special Show Night In Gokuldham Society,"All the members of Gokuldham Society are wondering what is the show about and also question Bagha and Abdul about it, as they were taking care of the decorations. Bhide complains to Jethalal about Tapu's new act. Guests are arriving in the colony. The show is just about to begin.",19 mins,2012-11-23,0.0,0.0,Gokuldham Society,Sony PAL,,1085683.0,8671.0,87.0,19.0,0,280,50,5,5.490196078431373,0,1,0,1,0,0,0,0,0,0.0,0,0,0.0,2012.0,11.0,23.0,4.0,4.0,0,5,0,0,0,0.0,0,0.007986670154483257,8.013381425902933e-05,0.008066803968742285
1014,Tapu Sena's Emotional Skit,"All the members of Gokuldham Society are eagerly waiting for Tapu Sena's surprise event which is just about to begin and the wait is finally over as Tapu Sena arrives with the team on the stage. Sodhi is essaying the role of a son, Sonu as a mother, and Goli as a father. Will Tapu Sena succeed in conveying their message? Will Tapu Sena manage to collect highest donations for project Roshni?",21 mins,2012-11-26,0.0,0.0,Gokuldham Society,Sony PAL,,4662283.0,48130.0,773.0,21.0,0,393,72,5,5.383561643835616,0,1,0,1,0,1,2,1,0,0.0,0,0,0.0,2012.0,11.0,26.0,0.0,4.0,0,5,0,0,0,0.0,786,0.010323266450520818,0.0001657985656815415,0.01048906501620236
1015,Tapu Sena Collects A Whopping Amount For Their Project Roshni,"Tapu has given a unique task to Madhavi and Jethalal and all the members of Gokuldham society, who are watching the act with lots of interest. After the act, Gokuldham colony members praise Tapu Sena for performing such a brilliant yet emotional act. Tapu Sena observes a blind couple who were seeking help.",20 mins,2012-11-27,0.0,0.0,Gokuldham Society,Sony PAL,,2256675.0,26207.0,674.0,20.0,0,307,53,4,5.685185185185185,0,1,0,1,0,0,0,0,0,0.0,0,0,0.0,2012.0,11.0,27.0,1.0,4.0,0,5,0,0,0,0.0,0,0.011613098202843473,0.0002986693703482467,0.011911767573191722
1016,Principal Takes A Drastic Step Against Tapu Sena,"Tapu takes his final call on the money that he had collected for Project Roshni but just when they were about to proceed towards their school, an accident occurs. In the school, Tapu Sena reveals the truth to their Principal and Teachers but Principal fumes in anger and urgently calls their Parents in the School. Will Gokuldham society believe in Tapu Sena? Has Tapu Sena committed a huge mistake.",20 mins,2012-11-28,0.0,0.0,Gokuldham Society,Sony PAL,,1981310.0,24418.0,704.0,20.0,0,399,69,5,5.7,0,1,0,1,0,0,1,1,0,0.0,0,0,0.0,2012.0,11.0,28.0,2.0,4.0,0,5,0,0,0,0.0,399,0.01232416314248495,0.0003553202904541488,0.0126794834329391
